{"asset_id":"loot_container_derelict_v1","binding":{"ids":["loot_container_derelict_v1"],"namespace":"visual_prop_id"},"bounds":{"local_max_m":[0.45,0.275,0.395],"local_min_m":[-0.45,-0.275,-0.17]},"collision_policy":"none_visual_only","document_kind":"prop_visual_binding","extensions":{"ai_generation":{"cleaned_output_sha256":"eebcead4f6620845dcc53819fff0e600ebc409435598dfedc259254640bfca92","contract_sha256":"5568a8735e4fca2d5db4b640802383e44302b9d0f7edbedf956fffc743699008","human_cleanup":true,"input_sha256":["3603ec42c5ab14fa01c3144ac886cbe3d9211f7861a8007067694bd67574ccb1","6cc22ff9843e07803177a3bfc643d48ffb65d4cb5c4b06d2115798ce77b280a0","3cb600ab73151aa422c94d3601dd6e78242bdf68f6d5e2058393208ebe06d2d7","82820f011876d0a36be3817fe50709c029d3ddc78ff3186f850f3c937f6ad70c"],"model":"meshy-t2","provider":"meshy","raw_output_sha256":"ff07ca3f0e87e29fb1a77c007cf261920ac370f870ead9c21446b4ad1f15e377","reviewer":"christopherwilloughby","task_id":"01a05dcb-fc3b-7418-b105-2170af354088"}},"placement":{"allowed_yaw_deg":[0.0,90.0,180.0,270.0],"offset_m":[0.0,0.0,0.0],"origin":"scene_origin","rotation_degrees":[0.0,0.0,0.0],"scale":1.0,"surface":"floor"},"prop_kind":"dressing","provenance":{"license_state":"paid-private","source_platform":"meshy"},"schema_version":"1.0.0","source":{"byte_size":67188,"gltf_version":"2.0","mesh_count":6,"sha256":"eebcead4f6620845dcc53819fff0e600ebc409435598dfedc259254640bfca92"},"visual_scene_path":"res://assets/imported/props/dressing/loot_container_derelict_v1.glb"}
